{
  "catalog_version": "2026-08-04-grammar-01",
  "generator_id": "sonantia-context-composer-03",
  "default_language": "es",
  "selection_policy": "deterministic_factorized",
  "recipient_names": [
    "David Alexander Bijman Molina"
  ],
  "policy": {
    "source_order": [
      "weather"
    ],
    "max_source_sections": 4,
    "weather_fact_count": 2,
    "max_message_characters": 2000
  },
  "openings": [
    {
      "value_id": "apertura-saludo-directo",
      "weight": 4,
      "text": "Saludos desde {{node.city}}",
      "requires": [
        "node.city"
      ]
    },
    {
      "value_id": "apertura-saludo-cordial",
      "weight": 4,
      "text": "Un cordial saludo desde {{node.city}}",
      "requires": [
        "node.city"
      ]
    },
    {
      "value_id": "apertura-saludo-enviado",
      "weight": 3,
      "text": "Desde {{node.city}} enviamos un saludo atento a la red",
      "requires": [
        "node.city"
      ]
    },
    {
      "value_id": "apertura-saludo-horario",
      "weight": 5,
      "text": "{{time.salutation}} desde {{node.city}}",
      "requires": [
        "time.salutation",
        "node.city"
      ]
    },
    {
      "value_id": "apertura-mensaje-horario",
      "weight": 3,
      "text": "{{time.salutation}}; este mensaje se emite desde {{node.city}}",
      "requires": [
        "time.salutation",
        "node.city"
      ]
    },
    {
      "value_id": "apertura-saludo-nodo",
      "weight": 3,
      "text": "El nodo {{node.node_id}} saluda desde {{node.city}}",
      "requires": [
        "node.node_id",
        "node.city"
      ]
    },
    {
      "value_id": "apertura-mensaje-nodo",
      "weight": 3,
      "text": "Desde {{node.city}}, el nodo {{node.node_id}} comparte una nueva señal",
      "requires": [
        "node.city",
        "node.node_id"
      ]
    },
    {
      "value_id": "apertura-ciudad-presente",
      "weight": 2,
      "text": "La ciudad de {{node.city}} se hace presente en la red",
      "requires": [
        "node.city"
      ]
    },
    {
      "value_id": "apertura-aprecio",
      "weight": 2,
      "text": "Con aprecio, enviamos esta publicación desde {{node.city}}",
      "requires": [
        "node.city"
      ]
    },
    {
      "value_id": "apertura-senal-red",
      "weight": 2,
      "text": "Desde {{node.city}} compartimos una nueva señal distribuida",
      "requires": [
        "node.city"
      ]
    },
    {
      "value_id": "apertura-nombre-nodo",
      "weight": 2,
      "text": "El {{node.display_name}} comparte un nuevo registro desde su ciudad",
      "requires": [
        "node.display_name"
      ]
    },
    {
      "value_id": "apertura-emision-actual",
      "weight": 1,
      "text": "La emisión actual del {{node.display_name}} comienza con este saludo",
      "requires": [
        "node.display_name"
      ]
    },
    {
      "value_id": "apertura-periodo",
      "weight": 2,
      "text": "Durante la {{time.day_period}}, enviamos un saludo desde {{node.city}}",
      "requires": [
        "time.day_period",
        "node.city"
      ]
    },
    {
      "value_id": "apertura-periodo-red",
      "weight": 2,
      "text": "En esta {{time.day_period}}, {{node.city}} comparte un mensaje para la red",
      "requires": [
        "time.day_period",
        "node.city"
      ]
    },
    {
      "value_id": "apertura-mensaje-cordial",
      "weight": 3,
      "text": "Desde {{node.city}} hacemos llegar un mensaje cordial",
      "requires": [
        "node.city"
      ]
    },
    {
      "value_id": "apertura-saludo-afectuoso",
      "weight": 2,
      "text": "Reciban un saludo afectuoso emitido desde {{node.city}}",
      "requires": [
        "node.city"
      ]
    },
    {
      "value_id": "apertura-conexion",
      "weight": 1,
      "text": "La red se conecta nuevamente con un saludo desde {{node.city}}",
      "requires": [
        "node.city"
      ]
    },
    {
      "value_id": "apertura-alegria",
      "weight": 1,
      "text": "Con alegría, el {{node.display_name}} transmite desde {{node.city}}",
      "requires": [
        "node.display_name",
        "node.city"
      ]
    },
    {
      "value_id": "apertura-pulso-ciudad",
      "weight": 3,
      "text": "{{node.city}} comparte el pulso de esta {{time.day_period}}",
      "requires": [
        "node.city",
        "time.day_period"
      ]
    },
    {
      "value_id": "apertura-registro-sereno",
      "weight": 2,
      "text": "Con una señal serena desde {{node.city}}, el nodo inicia su publicación",
      "requires": [
        "node.city"
      ]
    },
    {
      "value_id": "apertura-observacion-local",
      "weight": 2,
      "text": "Desde la observación local de {{node.city}}, compartimos este saludo",
      "requires": [
        "node.city"
      ]
    },
    {
      "value_id": "apertura-ciclo-presente",
      "weight": 2,
      "text": "En este ciclo, {{node.city}} vuelve a dejar constancia en la red",
      "requires": [
        "node.city"
      ]
    },
    {
      "value_id": "apertura-nodo-activo",
      "weight": 2,
      "text": "El {{node.display_name}} permanece activo y saluda desde {{node.city}}",
      "requires": [
        "node.display_name",
        "node.city"
      ]
    },
    {
      "value_id": "apertura-hora-local",
      "weight": 2,
      "text": "{{time.salutation}}; desde {{node.city}} se abre una nueva lectura del entorno",
      "requires": [
        "time.salutation",
        "node.city"
      ]
    },
    {
      "value_id": "apertura-red-cordial",
      "weight": 2,
      "text": "A los nodos de la red, enviamos un saludo cordial desde {{node.city}}",
      "requires": [
        "node.city"
      ]
    },
    {
      "value_id": "apertura-presencia-distribuida",
      "weight": 1,
      "text": "{{node.city}} confirma su presencia distribuida con una nueva emisión",
      "requires": [
        "node.city"
      ]
    },
    {
      "value_id": "apertura-senales-entorno",
      "weight": 1,
      "text": "Las señales del entorno acompañan este saludo desde {{node.city}}",
      "requires": [
        "node.city"
      ]
    }
  ],
  "declarations": [
    {
      "value_id": "declaracion-registro",
      "weight": 3,
      "text": "Este registro destaca que"
    },
    {
      "value_id": "declaracion-datos",
      "weight": 4,
      "text": "El mensaje central de esta publicación señala que"
    },
    {
      "value_id": "declaracion-transmision",
      "weight": 3,
      "text": "La transmisión comparte la idea de que"
    },
    {
      "value_id": "declaracion-antecedentes",
      "weight": 3,
      "text": "A partir del contexto disponible, recordamos que"
    },
    {
      "value_id": "declaracion-saludo",
      "weight": 3,
      "text": "Junto con este saludo, afirmamos que"
    },
    {
      "value_id": "declaracion-confianza",
      "weight": 2,
      "text": "El nodo comparte con confianza que"
    },
    {
      "value_id": "declaracion-conviccion",
      "weight": 2,
      "text": "Esta publicación expresa la convicción de que"
    },
    {
      "value_id": "declaracion-cierre",
      "weight": 2,
      "text": "Para completar el mensaje, señalamos que"
    },
    {
      "value_id": "declaracion-ciclo",
      "weight": 2,
      "text": "La reflexión de este ciclo recuerda que"
    },
    {
      "value_id": "declaracion-red",
      "weight": 2,
      "text": "Desde la red compartimos la idea de que"
    },
    {
      "value_id": "declaracion-puente",
      "weight": 3,
      "text": "La lectura del entorno da paso a la afirmación de que"
    },
    {
      "value_id": "declaracion-continuidad",
      "weight": 2,
      "text": "En continuidad con la publicación anterior, sostenemos que"
    },
    {
      "value_id": "declaracion-presente",
      "weight": 2,
      "text": "En el ciclo actual, el mensaje recuerda que"
    },
    {
      "value_id": "declaracion-armonia",
      "weight": 2,
      "text": "La observación local acompaña la certeza de que"
    },
    {
      "value_id": "declaracion-intencion",
      "weight": 2,
      "text": "Esta publicación expresa con claridad que"
    },
    {
      "value_id": "declaracion-testimonio",
      "weight": 1,
      "text": "Como parte de este momento, afirmamos que"
    },
    {
      "value_id": "declaracion-resonancia",
      "weight": 1,
      "text": "La publicación pone el acento en la idea de que"
    }
  ],
  "fallback_messages": [
    {
      "value_id": "respaldo-saludo",
      "weight": 4,
      "text": "{{time.salutation}} desde {{node.city}}. El nodo {{node.node_id}} comparte una nueva transmisión con la red",
      "requires": [
        "time.salutation",
        "node.city",
        "node.node_id"
      ]
    },
    {
      "value_id": "respaldo-cordial",
      "weight": 3,
      "text": "Desde {{node.city}} enviamos un cordial saludo a los nodos de la red",
      "requires": [
        "node.city"
      ]
    },
    {
      "value_id": "respaldo-ciclo",
      "weight": 2,
      "text": "El nodo {{node.node_id}} completó un nuevo ciclo de publicación desde {{node.city}}",
      "requires": [
        "node.node_id",
        "node.city"
      ]
    },
    {
      "value_id": "respaldo-presencia",
      "weight": 1,
      "text": "{{node.display_name}} confirma su presencia mediante esta publicación",
      "requires": [
        "node.display_name"
      ]
    },
    {
      "value_id": "respaldo-entorno",
      "weight": 2,
      "text": "Desde {{node.city}}, el nodo mantiene su publicación activa aunque no disponga de todos los datos del entorno",
      "requires": [
        "node.city"
      ]
    },
    {
      "value_id": "respaldo-continuidad",
      "weight": 1,
      "text": "El {{node.display_name}} conserva la continuidad de la red con un saludo público",
      "requires": [
        "node.display_name"
      ]
    }
  ],
  "source_templates": [
    {
      "source_id": "weather",
      "templates": [